{
  "acr_version": "1.0",
  "run_id": "2026-09-16T144918Z_codegen_ae568d4c9e80fe5377af3ad051886998",
  "artefact_id": "50bfde761acc5ece8c8e4f65a2838419f3a9e312bddb56916e3df9fffbfec178",
  "artefact_version": "1.0.0",
  "verdict": "conforms",
  "trace_integrity": "pass",
  "process_conformance": "pass",
  "misalignments": [],
  "completeness": {
    "result": "full"
  },
  "checked_at": 1791293108.2619534
}