{
  "acr_version": "1.0",
  "run_id": "2026-08-24T192337Z_hanoi3_fd635189862875d144074d879cc4cdf9",
  "artefact_id": "ba7359ae5bf662128e9b5c5f36efec43480b0a9cc9eb8dc58d7f827bb6a76618",
  "artefact_version": "1.0.0",
  "verdict": "violations",
  "trace_integrity": "fail",
  "process_conformance": "fail",
  "misalignments": [
    {
      "seq": 0,
      "class": "UNMEDIATED",
      "family": "TRACE_INTEGRITY",
      "expected": "every executed operation classifies to a cell",
      "observed": "'move' executed unclassified"
    },
    {
      "seq": 2,
      "class": "UNMEDIATED",
      "family": "TRACE_INTEGRITY",
      "expected": "every executed operation classifies to a cell",
      "observed": "'move' executed unclassified"
    },
    {
      "seq": 7,
      "class": "UNMEDIATED",
      "family": "TRACE_INTEGRITY",
      "expected": "every executed operation classifies to a cell",
      "observed": "'move' executed unclassified"
    },
    {
      "seq": 9,
      "class": "UNMEDIATED",
      "family": "TRACE_INTEGRITY",
      "expected": "every executed operation classifies to a cell",
      "observed": "'move' executed unclassified"
    },
    {
      "seq": 14,
      "class": "UNMEDIATED",
      "family": "TRACE_INTEGRITY",
      "expected": "every executed operation classifies to a cell",
      "observed": "'move' executed unclassified"
    },
    {
      "seq": 17,
      "class": "UNMEDIATED",
      "family": "TRACE_INTEGRITY",
      "expected": "every executed operation classifies to a cell",
      "observed": "'move' executed unclassified"
    },
    {
      "seq": 19,
      "class": "UNMEDIATED",
      "family": "TRACE_INTEGRITY",
      "expected": "every executed operation classifies to a cell",
      "observed": "'move' executed unclassified"
    },
    {
      "seq": 21,
      "class": "UNMEDIATED",
      "family": "TRACE_INTEGRITY",
      "expected": "every executed operation classifies to a cell",
      "observed": "'move' executed unclassified"
    },
    {
      "seq": 22,
      "class": "UNMEDIATED",
      "family": "TRACE_INTEGRITY",
      "expected": "every executed operation classifies to a cell",
      "observed": "'move' executed unclassified"
    },
    {
      "seq": 23,
      "class": "UNMEDIATED",
      "family": "TRACE_INTEGRITY",
      "expected": "every executed operation classifies to a cell",
      "observed": "'move' executed unclassified"
    },
    {
      "seq": 0,
      "class": "STRUCTURAL",
      "family": "PROCESS_CONFORMANCE",
      "expected": "one of: move_ac",
      "observed": "'move_invalid' occurred (not offered here)"
    },
    {
      "seq": 2,
      "class": "STRUCTURAL",
      "family": "PROCESS_CONFORMANCE",
      "expected": "one of: move_ab",
      "observed": "'move_invalid' occurred (not offered here)"
    },
    {
      "seq": 4,
      "class": "STRUCTURAL",
      "family": "PROCESS_CONFORMANCE",
      "expected": "one of: move_cb",
      "observed": "'move_ac' occurred (not offered here)"
    },
    {
      "seq": 6,
      "class": "STRUCTURAL",
      "family": "PROCESS_CONFORMANCE",
      "expected": "one of: move_ac",
      "observed": "'move_ba' occurred (not offered here)"
    },
    {
      "seq": 7,
      "class": "STRUCTURAL",
      "family": "PROCESS_CONFORMANCE",
      "expected": "one of: move_ac",
      "observed": "'move_invalid' occurred (not offered here)"
    },
    {
      "seq": 8,
      "class": "STRUCTURAL",
      "family": "PROCESS_CONFORMANCE",
      "expected": "one of: move_ac",
      "observed": "'move_ab' occurred (not offered here)"
    },
    {
      "seq": 9,
      "class": "STRUCTURAL",
      "family": "PROCESS_CONFORMANCE",
      "expected": "one of: move_ac",
      "observed": "'move_invalid' occurred (not offered here)"
    },
    {
      "seq": 11,
      "class": "STRUCTURAL",
      "family": "PROCESS_CONFORMANCE",
      "expected": "one of: move_ba",
      "observed": "'move_bc' occurred (not offered here)"
    },
    {
      "seq": 13,
      "class": "STRUCTURAL",
      "family": "PROCESS_CONFORMANCE",
      "expected": "one of: move_bc",
      "observed": "'move_ca' occurred (not offered here)"
    },
    {
      "seq": 14,
      "class": "STRUCTURAL",
      "family": "PROCESS_CONFORMANCE",
      "expected": "one of: move_bc",
      "observed": "'move_invalid' occurred (not offered here)"
    },
    {
      "seq": 15,
      "class": "STRUCTURAL",
      "family": "PROCESS_CONFORMANCE",
      "expected": "one of: move_bc",
      "observed": "'move_ac' occurred (not offered here)"
    },
    {
      "seq": 16,
      "class": "STRUCTURAL",
      "family": "PROCESS_CONFORMANCE",
      "expected": "one of: move_bc",
      "observed": "'move_ac' occurred (not offered here)"
    },
    {
      "seq": 17,
      "class": "STRUCTURAL",
      "family": "PROCESS_CONFORMANCE",
      "expected": "one of: move_bc",
      "observed": "'move_invalid' occurred (not offered here)"
    },
    {
      "seq": 18,
      "class": "STRUCTURAL",
      "family": "PROCESS_CONFORMANCE",
      "expected": "one of: move_bc",
      "observed": "'move_ab' occurred (not offered here)"
    },
    {
      "seq": 19,
      "class": "STRUCTURAL",
      "family": "PROCESS_CONFORMANCE",
      "expected": "one of: move_bc",
      "observed": "'move_invalid' occurred (not offered here)"
    },
    {
      "seq": 20,
      "class": "STRUCTURAL",
      "family": "PROCESS_CONFORMANCE",
      "expected": "one of: move_bc",
      "observed": "'move_cb' occurred (not offered here)"
    },
    {
      "seq": 21,
      "class": "STRUCTURAL",
      "family": "PROCESS_CONFORMANCE",
      "expected": "one of: move_bc",
      "observed": "'move_invalid' occurred (not offered here)"
    },
    {
      "seq": 22,
      "class": "STRUCTURAL",
      "family": "PROCESS_CONFORMANCE",
      "expected": "one of: move_bc",
      "observed": "'move_invalid' occurred (not offered here)"
    },
    {
      "seq": 23,
      "class": "STRUCTURAL",
      "family": "PROCESS_CONFORMANCE",
      "expected": "one of: move_bc",
      "observed": "'move_invalid' occurred (not offered here)"
    },
    {
      "seq": 24,
      "class": "STRUCTURAL",
      "family": "PROCESS_CONFORMANCE",
      "expected": "one of: move_bc",
      "observed": "'move_ba' occurred (not offered here)"
    }
  ],
  "completeness": {
    "result": "full"
  },
  "checked_at": 1787599790.843601
}